{
  "generatorVersion": "1.0.0",
  "package": "@zavx0z/renderer-webgpu",
  "records": [
    {
      "blockedBy": [],
      "blocks": [],
      "conformance": "extension",
      "consumers": [],
      "evidence": [
        {
          "doesNotProve": "Every symbol and observable behavior behind the path.",
          "path": "packages/webgpu/package.json",
          "proves": "The package export path exists.",
          "repository": "renderer",
          "revision": "3c91038c3f14ccc44616209fd82b1e59b7369408",
          "symbol": ".",
          "type": "implementation"
        },
        {
          "doesNotProve": "External-standard compatibility unless separately mapped.",
          "path": "packages/webgpu/test/webgpu-backend.test.ts",
          "proves": "The bounded project API has behavioral coverage.",
          "repository": "renderer",
          "revision": "3c91038c3f14ccc44616209fd82b1e59b7369408",
          "symbol": ".",
          "type": "unit-test"
        }
      ],
      "id": "platform.at-zavx0z-renderer-webgpu.export-paths.root",
      "lastVerified": {
        "date": "2026-08-29",
        "revision": "3c91038c3f14ccc44616209fd82b1e59b7369408"
      },
      "limitations": [],
      "owner": {
        "package": "@zavx0z/renderer-webgpu",
        "repository": "renderer",
        "stage": "webgpu"
      },
      "status": "implemented"
    },
    {
      "blockedBy": [],
      "blocks": [],
      "conformance": "extension",
      "consumers": [],
      "evidence": [
        {
          "doesNotProve": "Observable runtime behavior or semantic conformance.",
          "lines": "1",
          "path": "packages/webgpu/src/index.ts",
          "proves": "The public export exists at the pinned revision.",
          "repository": "renderer",
          "revision": "3c91038c3f14ccc44616209fd82b1e59b7369408",
          "symbol": "RendererWebGpuBackend",
          "type": "implementation"
        },
        {
          "doesNotProve": "External-standard compatibility unless separately mapped.",
          "path": "packages/webgpu/test/webgpu-backend.test.ts",
          "proves": "The bounded project API has behavioral coverage.",
          "repository": "renderer",
          "revision": "3c91038c3f14ccc44616209fd82b1e59b7369408",
          "symbol": "RendererWebGpuBackend",
          "type": "unit-test"
        }
      ],
      "id": "platform.at-zavx0z-renderer-webgpu.export-paths.root.symbols.rendererwebgpubackend",
      "lastVerified": {
        "date": "2026-08-29",
        "revision": "3c91038c3f14ccc44616209fd82b1e59b7369408"
      },
      "limitations": [],
      "owner": {
        "package": "@zavx0z/renderer-webgpu",
        "repository": "renderer",
        "stage": "webgpu"
      },
      "status": "implemented"
    },
    {
      "blockedBy": [],
      "blocks": [],
      "conformance": "unknown",
      "consumers": [],
      "evidence": [
        {
          "doesNotProve": "Observable runtime behavior or semantic conformance.",
          "lines": "2",
          "path": "packages/webgpu/src/index.ts",
          "proves": "The public export exists at the pinned revision.",
          "repository": "renderer",
          "revision": "3c91038c3f14ccc44616209fd82b1e59b7369408",
          "symbol": "RendererWebGpuBackendDiagnostics",
          "type": "implementation"
        }
      ],
      "id": "platform.at-zavx0z-renderer-webgpu.export-paths.root.symbols.rendererwebgpubackenddiagnostics",
      "lastVerified": {
        "date": "2026-08-29",
        "revision": "3c91038c3f14ccc44616209fd82b1e59b7369408"
      },
      "limitations": [
        "Export/type presence is not behavioral evidence."
      ],
      "owner": {
        "package": "@zavx0z/renderer-webgpu",
        "repository": "renderer",
        "stage": "webgpu"
      },
      "status": "unverified"
    },
    {
      "blockedBy": [],
      "blocks": [],
      "conformance": "unknown",
      "consumers": [],
      "evidence": [
        {
          "doesNotProve": "Observable runtime behavior or semantic conformance.",
          "lines": "2",
          "path": "packages/webgpu/src/index.ts",
          "proves": "The public export exists at the pinned revision.",
          "repository": "renderer",
          "revision": "3c91038c3f14ccc44616209fd82b1e59b7369408",
          "symbol": "RendererWebGpuBackendOptions",
          "type": "implementation"
        }
      ],
      "id": "platform.at-zavx0z-renderer-webgpu.export-paths.root.symbols.rendererwebgpubackendoptions",
      "lastVerified": {
        "date": "2026-08-29",
        "revision": "3c91038c3f14ccc44616209fd82b1e59b7369408"
      },
      "limitations": [
        "Export/type presence is not behavioral evidence."
      ],
      "owner": {
        "package": "@zavx0z/renderer-webgpu",
        "repository": "renderer",
        "stage": "webgpu"
      },
      "status": "unverified"
    },
    {
      "blockedBy": [],
      "blocks": [],
      "conformance": "extension",
      "consumers": [],
      "evidence": [
        {
          "doesNotProve": "Observable runtime behavior or semantic conformance.",
          "lines": "8",
          "path": "packages/webgpu/src/index.ts",
          "proves": "The public export exists at the pinned revision.",
          "repository": "renderer",
          "revision": "3c91038c3f14ccc44616209fd82b1e59b7369408",
          "symbol": "RendererWebGpuDocumentPlane",
          "type": "implementation"
        },
        {
          "doesNotProve": "External-standard compatibility unless separately mapped.",
          "path": "packages/webgpu/test/webgpu-backend.test.ts",
          "proves": "The bounded project API has behavioral coverage.",
          "repository": "renderer",
          "revision": "3c91038c3f14ccc44616209fd82b1e59b7369408",
          "symbol": "RendererWebGpuDocumentPlane",
          "type": "unit-test"
        }
      ],
      "id": "platform.at-zavx0z-renderer-webgpu.export-paths.root.symbols.rendererwebgpudocumentplane",
      "lastVerified": {
        "date": "2026-08-29",
        "revision": "3c91038c3f14ccc44616209fd82b1e59b7369408"
      },
      "limitations": [],
      "owner": {
        "package": "@zavx0z/renderer-webgpu",
        "repository": "renderer",
        "stage": "webgpu"
      },
      "status": "implemented"
    },
    {
      "blockedBy": [],
      "blocks": [],
      "conformance": "unknown",
      "consumers": [],
      "evidence": [
        {
          "doesNotProve": "Observable runtime behavior or semantic conformance.",
          "lines": "9",
          "path": "packages/webgpu/src/index.ts",
          "proves": "The public export exists at the pinned revision.",
          "repository": "renderer",
          "revision": "3c91038c3f14ccc44616209fd82b1e59b7369408",
          "symbol": "RendererWebGpuDocumentPlaneIntersection",
          "type": "implementation"
        }
      ],
      "id": "platform.at-zavx0z-renderer-webgpu.export-paths.root.symbols.rendererwebgpudocumentplaneintersection",
      "lastVerified": {
        "date": "2026-08-29",
        "revision": "3c91038c3f14ccc44616209fd82b1e59b7369408"
      },
      "limitations": [
        "Export/type presence is not behavioral evidence."
      ],
      "owner": {
        "package": "@zavx0z/renderer-webgpu",
        "repository": "renderer",
        "stage": "webgpu"
      },
      "status": "unverified"
    },
    {
      "blockedBy": [],
      "blocks": [],
      "conformance": "unknown",
      "consumers": [],
      "evidence": [
        {
          "doesNotProve": "Observable runtime behavior or semantic conformance.",
          "lines": "9",
          "path": "packages/webgpu/src/index.ts",
          "proves": "The public export exists at the pinned revision.",
          "repository": "renderer",
          "revision": "3c91038c3f14ccc44616209fd82b1e59b7369408",
          "symbol": "RendererWebGpuDocumentPlaneOptions",
          "type": "implementation"
        }
      ],
      "id": "platform.at-zavx0z-renderer-webgpu.export-paths.root.symbols.rendererwebgpudocumentplaneoptions",
      "lastVerified": {
        "date": "2026-08-29",
        "revision": "3c91038c3f14ccc44616209fd82b1e59b7369408"
      },
      "limitations": [
        "Export/type presence is not behavioral evidence."
      ],
      "owner": {
        "package": "@zavx0z/renderer-webgpu",
        "repository": "renderer",
        "stage": "webgpu"
      },
      "status": "unverified"
    },
    {
      "blockedBy": [],
      "blocks": [],
      "conformance": "unknown",
      "consumers": [],
      "evidence": [
        {
          "doesNotProve": "Observable runtime behavior or semantic conformance.",
          "lines": "9",
          "path": "packages/webgpu/src/index.ts",
          "proves": "The public export exists at the pinned revision.",
          "repository": "renderer",
          "revision": "3c91038c3f14ccc44616209fd82b1e59b7369408",
          "symbol": "RendererWebGpuDocumentPoint",
          "type": "implementation"
        }
      ],
      "id": "platform.at-zavx0z-renderer-webgpu.export-paths.root.symbols.rendererwebgpudocumentpoint",
      "lastVerified": {
        "date": "2026-08-29",
        "revision": "3c91038c3f14ccc44616209fd82b1e59b7369408"
      },
      "limitations": [
        "Export/type presence is not behavioral evidence."
      ],
      "owner": {
        "package": "@zavx0z/renderer-webgpu",
        "repository": "renderer",
        "stage": "webgpu"
      },
      "status": "unverified"
    },
    {
      "blockedBy": [],
      "blocks": [],
      "conformance": "extension",
      "consumers": [],
      "evidence": [
        {
          "doesNotProve": "Observable runtime behavior or semantic conformance.",
          "lines": "6",
          "path": "packages/webgpu/src/index.ts",
          "proves": "The public export exists at the pinned revision.",
          "repository": "renderer",